<?xml version="1.0" encoding="utf-8"?>
<xs:schema id="recipe_schema"
    elementFormDefault="qualified"
    xmlns:xs="http://www.w3.org/2001/XMLSchema"
>
  <xs:element name="Recipes">
    <xs:complexType>
      <xs:sequence>
        <xs:element name="Recipe" minOccurs="0" maxOccurs="unbounded">
          <xs:complexType>
            <xs:sequence>
              <xs:element name="Name" type="xs:string" />
              <xs:element name="Calories" type="xs:int" />
              <xs:element name="Time" type="xs:string" />
              <xs:element name="Ingredients">
                <xs:complexType>
                  <xs:sequence>
                    <xs:element name="Ingredient" minOccurs="0" maxOccurs="unbounded">
                      <xs:complexType>
                        <xs:sequence>
                          <xs:element name="Amount" type="xs:string" />
                          <xs:element name="Name" type="xs:string" />
                        </xs:sequence>
                      </xs:complexType>
                    </xs:element>
                  </xs:sequence>
                </xs:complexType>
              </xs:element>
              <xs:element name="Preparation" type="xs:string" />
            </xs:sequence>
          </xs:complexType>
        </xs:element>
      </xs:sequence>
    </xs:complexType>
  </xs:element>
</xs:schema>